rating,review_text,title,helpful_votes
4,"The earbuds are really good and high quality, the in hand feel and ear feel is great but for the price I feel like more features could have been given such as better noise isolation... For me the right earbud appears to be lose, falling out easier than the left, tried changing eartips but it was the same, maybe my right ear canal is wider but felt important to mention. The clarity is great, the charging is fast and the earbuds last a really long time, I have been using them for a couple weeks now and even after using them for couple house straight 3-4+ they still remaind above 40% with ANC off. With ANC on it was 20% after 4 hours. Over all really good earbuds but some extra features at this price such as better fitting and noise isolation would make them great.",Good but not enough to justify the price,5
4,"Model name :- Ptron zenbuds X1I have been using these buds for 2 and a half months. Here is my honest review.1) Sound quality (8/10) - Good sound quality. Clear vocals. But highs and lows keep changing in a song. May feel high and low in sound while listening to a song. Sometimes a weird creaking sound comes while listening for a long time. I don't know why.2) Bass (7/10) - Average bass. Not too deep bass. But a satisfactory bass. It is good. Bass lovers may be disappointed but is good for this price range.3) Design ( 9/10) - Nice design. But case lid is average. Lid is not too tight. But, buds won't fall. Magnets in it are good.4) comfort (9/10) - Very good comfort. Using proper earcups (rubber) will keep tight fitting in year. Can use for more than 2 hours.5) Modes (10/10) - There are different modes available for different purposes. There are 3 modes available :- Game mode, Movie mode and Music mode. Although all sound the same, there is a little bit difference felt when changing the mode and listening6) Functionality :- 13mm drivers, BT 5.3 connectivity, In ear sensors ( Plug in ear to song play, remove the earbuds from ears and music will pause, plug in again and it will play), IPX5 water resistant, Low latency gaming, Four Quad mics ENC calls, Type C charging (Note :- use only a 10 W charger and not more than that. Never use 25W , 33W , 50W, 65W, 100W etc) .7) Battery - The box says 40 hours play time. Not sure correct or not. But it does come around 40 hours only. Again use a 10w charger and not more than that. Charging or battery indicator is also given. When the case light is still green color, means charge is there, like when u put buds in case green light turns ON and stays constant means buds are charging. Also buds have light. Once fully charged case light will Off. If case light blinks means case battery is low. When case is put in charge red light will show blinking.( always put buds in case while charging). Once case is fully charged the red light will stay constant. Detach the charger then. Then it will start showing green light. The light turns off on its own after a few minutes so don't worry.Overall a good product and features are good according to the price. I bought it for 799rs",Ptron zenbuds X1,5
4,"1) Sound is really exceptional for a 12.4mm driver. Audio for my buds felt shifted a bit towards right. Adjustable in phone settings: Go to Accessibility --> Hearing --> Channel Volume Balancing. If this setting is not available on your device, replace your buds, contact Realme Support.2) Bass is not that punchy but adjustable in their app.3) Treble felt a bit peaked making the sound sharp for ears but simultaneously clear with the seperation. Unfortunately there is no option to adjust it unless you how to adjust custom equalizer.4) Spatial Audio is good, don't expect it to as good as bose, Sennheiser or Apple but for entry level, acceptable.5) Dolby Atmos works only if your mobile supports it. Check in your audio settings before purchasing. In my device it works (Realme X7 Max)6) Charging is durable as mentioned in the description.7) Design feels comfortable but the ear tips size should have been a bit bigger (depends on your ear canal, mine is wider than usual).8) Case hinges are great and tight.9) Colour depends on what you select and finish is mat and scratches aren't visible if any. LED works as intended.10) Charging port should have had a cover. For longer run, dust will surely accommodate in it. Make sure to clean it regularly.",Overall Review,5
5,"One Plus Buds 3 is a very good buy for me.Its sound is very good.Noise Cancelation works wonderfully.Can be connected to 2 devices at a time.Quick connect works wonderfully. As soon as we open the case, bluetooth gets connected.If you remove any one buds from ear, the song or movie will stop and as soon as you put it in again in ear, it resumes.The only thing which gave some confusion to me is the case. Its hinge is kind of here & there. Like if you try to check its sides and from mid, it looks like its moving. Not much impact. Just a bit.Otherwise its a good buy with what this price tag",Good Buy with these features,5
5,"The earpiece is comfortable and I am able to wear it for a long time. These buds are light and easy to wear. You are given three different sizes to choose from for the ear pads so you get the best fit. I honestly was blown away by the sound quality of these earbuds. Sound was crisp and base quality was very good. The noise cancellation feature is amazing which helps me to communicate even in a noisy environment. The earbuds connectivity is great too. As soon you put the ear piece in your ear is connects automatically which I love a lot. There are Type-C charging ports, which is very usefull and unique. The Type-C charging ports ensure compatibility with Android chargers. The battery life is impressive as I can use it for hours without needing to constantly recharge it. Overall, very nice earbud to have and highly recommended......",Good product 👍👍👍,5
5,"The video showcases the product in use.The video guides you through product setup.The video compares multiple products.The video shows the product being unpacked.Video Player is loading.Play VideoPlayMuteCurrent Time 0:00/Duration 0:54Loaded: 5.56%0:00Stream Type LIVESeek to live, currently behind liveLIVERemaining Time -0:54 1xPlayback RateChaptersChaptersDescriptionsdescriptions off, selectedCaptionscaptions off, selectedEnglish (Automated)Audio Trackdefault, selectedFullscreenThis is a modal window.


I'm a big fan of Samsung products and using samsung buds from last couples of years. This is my 4th ear buds from samsung. As usual the sound quality is really good and bass lovers can use equalizer option for extra bass. Sound quality of mic is also great while talking on call. As I told you that I'm a great fan of Samsung, but the only one con is there, you have to be carefull while traveling with buds, if you lost it you cannot track and do not hope to get it back.",I'm a big fan of Samsung products and using samsung buds from last couples of years.,5
5,"Writing this review while listening to music after 6 months of using it. Sounds excellent for the price. My friends use 2k priced pods when they listen music in this earphones their expression say it. It's like carrying a movie theater experience in your pockets. Sounds amazing and balanced sound. You get good noise cancellation, spatial audio is noticeable and good bass.Strong build you get the premium feel. When they fall on floor it sounds solid. Previous I used Skullcandy, boat, oneplus, mi. I can guarantee that you get what you pay.Good battery backup I charge once in 3 days.Cons.........Sometimes I face connection issue which is once in a month like that.That's it no other issue.",Immersive Sound,5
5,"The media could not be loaded.
                



I'm a big fan of Samsung products and using samsung buds from last couples of years. This is my 4th ear buds from samsung. As usual the sound quality is really good and bass lovers can use equalizer option for extra bass. Sound quality of mic is also great while talking on call. As I told you that I'm a great fan of Samsung, but the only one con is there, you have to be carefull while traveling with buds, if you lost it you cannot track and do not hope to get it back.",I'm a big fan of Samsung products and using samsung buds from last couples of years.,5
4,"1. Sound quality is good but make sure you get a customised equaliser (easily available on internet) for mids-highs.2. Bass is good but keep it balanced.3. Looks premium earbuds with matte finish case. Earpieces are not so shiny as shown in website pictures but really good looking and best fit for every ear size.4. In this budget, either take this or Realme earbuds, both are best options. - Relame has balanced sound but not good looking colours available.I am attaching some real photos for better idea.",Good earbuds for 2500 budget,6
4,"Sound quality of these earbuds are goodBass heavy(You should tweak it according to your liking through heymelody eq)One more thingIf you are going to buy it for ANC I would say it is decent like it’ll do the job (in any sense the ANC is not bad but don’t get your hopes too high that you’ll get a high end ANC)Use 3D audio (hey melody app)You can also use golden sound too to give you a bit better listening experience (although it can be useless to some people but do try it)My verdictSound quality:- 4.4/5ANC:- 4/5(don’t expect high level ANC like Bose or AIRPODS OR SONY)Bass:- 4.8/5(it’s good)Build (case):- 4.3/5(feels premium tbh)Comfort:-4.8/5(best part about these earphone is it’s comfort)Touch response:-4.4/5(it’s good)Fit :- 4.6/5(for me,but it can vary)That’s it guysAnd the package was delivered safelyGenuine product.",Jack of all trades,6
4,"I have been using relame buds air 3 for last 2 years. But i felt it's time to upgrade,  so went at first went with galaxy buds 2 pro for my s23. Frankly they are worse in fit,battery,ANC(during bike/cycling),touch controls. So returned it and went with realme buds 6 pro.My observation (not an audiophile)1. Sound : they are for sure on par or better than buds 2 pro and realme air 3. Has clear and good vocals, great Bass and treble.2. Touch controls :could have been better with support for volume controls using sliding touch.3. Features: surround sound(360° audio) is good.  There is no support of spatial audio. Coming to other features like in ear recognition for pause and play is awesome. ANC works well, transparency mode could be improved.  It would be better if they had voice detect feature like galaxy buds 2 pro.4. Battery : best in class.5. Build : very good except eartips. They same eartips as realme air 3. I have only one problem with these eartips. They are very thin which causes them to disform while inserting and removing. It is not at all expected. They should have used good material for the price of 5k.",Mixed review,6
4,"First and foremost I'd get out the issues:1. The ANC works well 90% of the time, but sometimes when I travel by road, I still keep hearing the vehicle horns or when I go by metro, I can still hear loud voices, even in full ANC mode.2. The Biggest issues is the brief pause that happens when I switch between apps on my phone. For example, if I'm listening to music from my music app thru these headphones and I go to a game app, it pauses the sound for a second and then plays again. This happens even when I come back to home screen.3. The bass is quite good but does not work as well in noisy environments even when ANC is on. So, I keep increasing the bass manually and the music loses quality.Those were the main issues I've faced, but by now my ears have been habituated to them, so they aren't that troubling for me anymore (that's why 4 stars). These are good ones for budget wireless earbuds and especially if you own a OnePlus phone.",Works quite well... but has some notable issues,6
5,"This product is gr8 for callings required for office calls. Listening music and for other purposes as well. Also, it is compatible for iphones and to make the best of use earbuds hey melody app is required. It has ANC and advanced features. Customization can be done using hey melody app. Great built, mic functionality, noise cancellation. Would recommend for office users",Gr8 for calling and listening music,6
4,"Considering the price point and the hardware provided it is still one of the best alternative to Oppo enco earbuds ( Including Oppo enco X2) if you tune it properly.Probably might have been the best product if realme had tuned it properly out of the box. With the hardware provided realme is definitely not sincere to this buds in tuning the earbuds to the fullest of its potential.Out of the box it is bass heave any sounds muddy in the mids, and highs are also not so clear.Once you tweak it as per your required sound signature using the equilizer you can achieve one of the best possible output from these buds. Even better than those which costs more than double than these.Pros :1. Good built quality.2. Pairs with both Android and IOS devices without issue.3. Dual device pairing4. Awesome ANC for the price range.5. Superb battery life with fast charging.6. Great call quality.7. Realme link app support for customization.8. Almost nil false touches.9. LDAC available for high res audio.Cons :1. Almost looks like a copy of Airpods series.2. Getting used to touch controls on the buds takes some time.3. Bad music tuning out of the box from realme.",Value for money with great sound quality after you tweak it,7
4,"I had Realme Buds air pro2 and upgraded to these ones. Been using them for past 5 days now. Here are my Pros and ConsCons:1. Outer case is scratch magnet. Will need cover2. Difficult to remove headsets from the case especially if you have large/ thick fingers3. The announcement when you change mode etc is very loud and there is no way to reduce its volumePros1. Excellent sound and call quality. It is by far the best sounding headsets in this price range2. App is very well with some added features over pro2.3. I have 2 iPhones and these surprisingly connect well to both, again unlike Pro24. ANC and Ambient mode are very good too; no complaints4. Extremely light weight and fits in your pocket easily5. Very very good battery life6. Lot of options to tune sound to suit one’s preference, I am sure one can find the sound he/ she likes",Excellent value for money,7
4,"This is my 4th Oneplus audio product. I have previously used the Bullets Z, Bullets Z2 and the Buds Z2. I also have the Sony WF-C700N. And after my experiences with all these products, I bought the Nord Buds 2r at 1500 rs. And I am truly amazed. At under 2000 I don't think there is a more balanced TWS in the market. Most TWS at this range focuses on being bass heavy, and this too has a boomy bass unlike the ones in the Oppo, Boat or Boult ones in this range. The sound signature can be tuned in the app. The Oppo buds above 3000 is perhaps much better but at this range Oneplus is the king. I feel using the default sound profile, the sound doesn't hurt your ears in long hours of usage. The drivers are good. The ENC is fair enough for the price. You can take calls. Not the best experience but a very decent one. Overall, I would rate this as one of the best under 2000 and if you get it at 1500, it is a steal deal.",Bang for the buck !!,7
5,"I recently got my hands on the Ptron Bassbuds duo, and I have to say, they have exceeded my expectations. As someone who is conscious of their budget, I was initially unsure about how they would perform, but after testing them out, I have been pleasantly surprised by what they offer for their price.Sound Quality: The standout feature of the Ptron Bassbuds duo is their impressive audio quality. The bass response is strong and impactful, as the name suggests. For those who enjoy bass-heavy music, these earbuds will not disappoint. However, the bass does not overwhelm and maintains a good balance with the mids and highs. The overall sound profile leans towards warmth, making them ideal for genres such as pop, hip-hop, and electronic music.Design and Comfort: The design of the Ptron Bassbuds duo is sleek and compact, with a glossy finish that gives them a premium look. The earbuds fit comfortably in my ears and come with multiple ear tip sizes to ensure a personalized fit for long-term use. I appreciate the touch controls, which are easy to use for managing playback and calls without needing to reach for my device.Battery Life: The battery life of the Ptron Bassbuds duo is impressive. With a full charge, I was able to get approximately 4.5 to 5 hours of continuous playback, and the charging case provided an additional 27 hours, which is more than sufficient for my daily usage. The inclusion of a USB Type-C charging port allows for quick and convenient charging.Connectivity: Pairing the Bassbuds duo with my smartphone was simple, and they maintained a stable connection with minimal interruptions during use.Call Quality: While the sound quality for music playback is excellent, the call quality on the Ptron Bassbuds duo is average. Callers mentioned that my voice sounded slightly muffled, and the built-in microphone did not provide the best noise isolation in noisy environments.Final Thoughts: The Ptron Bassbuds duo offer great value for money, delivering an impressive audio experience at an affordable price. They excel in bass reproduction, making them a great option for bass enthusiasts. The design, comfort, and battery life are all noteworthy, and the addition of touch controls is a positive feature. Although the call quality could be improved, it is not a significant issue considering the overall package.If you are looking for wireless earbuds that provide excellent sound performance and functionality without breaking the bank, the Ptron Bassbuds duo are a fantastic choices",Quality product,7
5,"OnePlus buds 3 are exceptional piece of earbuds you can buy right now in the market, These lovely buds will be praised for its performance, I'm myself a audio engineer and audiophile, i can approve these buds have definitely set the benchmark for true meaning of value for money, from sub bass to crispy airy high frequency these are phenomenal because you have control over each section of frequency band and further tweak those frequency as per your liking, These buds bangs the sub bass in 15 to 40hz and highs also sounds smooth they do not create fatigue, Hey melody app is great but i also use XEQ app for more tweaks, I'm definitely in love with these, Cheers to OnePlus for raising the bar so high that companies understand the value for money of there products.Edit :- Applying Golden Sound is very important because it will recognise your ear canal fit and further adjust the frequency of each band as per your hearing, cheers❤️🙏",Ethereal Music Experience,7
4,"The media could not be loaded.
                



Under 2000 best earbuds and long battery backup performance is good not issue in connectivity call quality decent not show good not show bad but ok type uses kae upar depand hae gaming profmance is good 👍 45 ultra low latency perfect working in gaming anyone buy this earbuds don't worry buy it  good earbuds for music 🎵 gaming",Boult astra,8
4,"After using for two weeks:Likes:Great aesthetic with breathing lights.Good base and sound quality.Great choice if you want to make calls in crowded place, ENC is good.Dislikes:Got delivered with one light not working.Dropped it once and its lid got lose, fragile build.Can't pair two devices at once, which is now a very common feature in TWS at this price.","Great ENC for clear calls, a little fragile and no Dual device pair",8
4,"Pros1.Clear vocal,Loud Bass,Crisp Trebble,Long Battery Life,Dual Connection,Quad Mic, Premium Built, Dedicated pairing button.Cons1.Lack in ear detection.",A feature packed in budget.,8
5,"The media could not be loaded.
                



The JBL TUNE 245NC TWS earbuds are a game-changer for music lovers on the go! With their customized extra bass and advanced noise-cancelling features, you can immerse yourself in your favorite tunes without any distractions. The battery life is impressive, offering up to 48 hours of playtime, ensuring you're covered even on the longest trips. Plus, the quick charge function is a lifesaver when you're in a hurry. The IP54 rating means they're durable and resistant to dust and water, making them perfect for all kinds of adventures. Whether you're commuting, traveling, or just enjoying a quiet moment, these earbuds are sure to enhance your audio experience.",Loved it!!,8
1,"Its been barely a month since i bought these and the left Ear Bus has stopped working, it just doesn’t charge in the case. Called customer care but of no use. No information provided on what i should do, but they diligently sent a Call Review Email. Highly Saddened by the poor quality of a very expensive product. Regret buying it.",Poor Product and Very Poor Service.,9
4,"Delivered Today. Experience till now 5 hours of ussage.1. The case and the buds looks premium.2. Attended multiple teams call. Voice quality is Cristal clear. No lags. ANC is really good. Utensils sounds, kids screaming from faraway, traffic noice were almost 0.3.Sound quality in youtube video very good.  You can hear sounds of every percussion.4. Tried with some music apps, satisfied with sound quality. It feels like you are using some premium earpod.5. Not sure it's a defect - whenever you touch the pod the volume will increase.6. Connectivity - no issues.","Liked the looks, Sound quality and built in quality",9
4,"Using it for 3-4 months now Decent sound quality, good build quality in compared to the boat ones i had which used to split open every time I dropped em, plastic feels durable, even accidentally poured a bucket on me head with these bad boys on,  still were fine, only drawback is that their range is not good + if I ever cover one of my ear with my arm while laying on my side, they sometimes stop working? Anyway the last point is really a nitpicking, i recommend en anyway 👍",Mmmm yummy yummy sound,9
5,"The comfort is nice, sound clarity is really good as it provides 24-bit audio, functionality is a bit tricky as i switched from Skullcandy Crusher Evo to the Buds 2 Pro. The design and colour is eye-catching, durability is good but the bass could have been better. The only negative point is the bass otherwise this is an awesome product. Definitely worth the price, i got it for 8k😊",Excellent product,9
4,"The product has the best ANC for calls after comparing these with other earbuds such as Bose earbuds and NG noise cancelling over ear headphones. The form factor is small, the product material is professional with smooth finish and easy to use with multiple utility options for a Samsung phone user. The calls are much clearer and the other person on call gets complete clear voice.There are three downsides:1. The sound quality for music and media is not that great as compared to Bose or Sony2. For my wear size though the fit is perfect but after a while it starts hurting the ear.3. The earbuds lack multipoint and cannot connect to multiple devices at the same time.The buds are best in term sof daily use for calls and online meetings. Amazing product.",Excellent Noise Cancellation for calls,10
5,"The media could not be loaded.
                



I recently got my hands on the Ptron Bassbuds duo, and I must say, they have been quite a pleasant surprise.As a budget-conscious consumer, I was initially skeptical about their performance, but after putting them to the test, I'm impressed with what they offer for the price.Sound Quality: The standout feature of the Ptron Bassbuds duo is their audio quality. The bass response is punchy and powerful, as the name suggests. For bass enthusiasts, these earbuds won't disappoint. However, the bass isn't overpowering and still maintains a good balance with the mids and highs. The overall sound signature leans towards warmth, which makes them ideal for genres like pop, hip-hop, and electronic music.Design and Comfort: The design of the Ptron Bassbuds duo is sleek and compact, with a glossy finish that gives them a premium appearance. The earbuds fit snugly in my ears and come with multiple ear tip sizes, ensuring a comfortable fit for extended use. I appreciate the inclusion of touch controls, which are intuitive and responsive for managing playback,and calls without reaching for my device.Battery Life: The battery life on the Ptron Bassbuds duo is quite impressive. On a full charge, I was able to get around 4.5 to 5 hours of continuous playback, and the charging case provided an additional 27 hours, which is more than enough for my daily needs. The USB Type-C charging port is a welcomed addition for quicker and hassle-free charging.Connectivity: Pairing the Bassbuds duo with my smartphone was effortless, and they maintained a stable connection with minimal dropouts during use.Call Quality: While the sound quality for music playback is excellent, the call quality on the Ptron Bassbuds duo is average. Callers on the other end reported my voice to be slightly muffled, and the built-in microphone didn't provide the best noise isolation in noisy environments.Final Thoughts: The Ptron Bassbuds duo offer exceptional value for money, providing an impressive audio experience at a budget-friendly price point. They excel in bass reproduction, making them a great choice for bass lovers. The design, comfort, and battery life are commendable, and the inclusion of touch controls is a definite plus. While the call quality could be improved, it's not a deal-breaker considering the overall package.If you're on a budget and seeking a pair of wireless earbuds that deliver on sound performance and functionality, the Ptron Bassbuds duo are an excellent choice",About ptron zenburd evo x2,10
