rating,review_text,title,helpful_votes
1,Bud can be Full charge  but not long time back Up 1 and haff hours  work and then discharge battary and buds ......,Production deffeg:,0
1,i never use in future this brand,sound is not clear very bad experience,0
1,Left side not working Airbert,Not working,0
1,Connecting device. not propar work noise cancellation.,Don't buy,0
1,Not Working,Very Sad,0
1,"Don't buy this Crossbeats, I brought Crossbeats slide for 1299 in offer and when I received it the sound quality is worst than 800rs Earbuds and after 2 days left earbuds is not working.Please improve your quality and enter the market clean.",Worst and fake Product,0
1,Noise cancellation function is not effective. And calling function is poor quality this is the JBL air buds quality 😡😡😡😡😡,I am not satisfied,0
1,BED PRODUCT AND BED AMAZON SERVICEI AM NEVER SHOPING AMAZON,Ekdam Gatiya Product,0
1,Bad ear fit looks like cheap JBL product can not wear more than 10 minutes even tried all rubber option still not fittingpaining and keeps falling from ears,Very bad EAR FIT,0
1,Sound quality is very bad 😞,Sound quality is not good,0
1,"Used item, law sound",Very bad,0
1,For 3000 r/s  we can purchase super sound quality of ear buds other than jbl,Not worth for money,0
1,"The worst call quality from JBL and the right piece stopped working in 15days .. Not even eligible for a return now.Genuine feedback guys, stay out of this !!!","Genuine feedback guys, stay out of this !!!",0
1,,Coustomer care,0
1,The earbuds are deceptively marketed and mentioned as ANC buds. It can be safely stated that they do not have any Active Noise Cancellation. If you are looking for buds having active noise cancellation please avoid these buds. You can find better buds than these in a lower price.,Deceptive Marketing,0
1,Plz don’t parchase jbl earbuds quality is very badAnd don’t sapport amazone,Wrost product jbl,0
1,With in 2 months it’s not even two months now battery is backup is gone down 80%.it is frustrating and total waste of money.,Battery is very BAD,0
1,Please dont buy this earphones for gaming purpose. An earphone that too JBL worth 3k+ thats not expected too much audio delay while playing BGMI. Really disappointed with JBL other brands in the same price range is giving perfect audio for gaming tooo,Latency in BGMI,0
1,Worth the money spent so far.,Worth the money spent.,0
1,I request to all no one please buy any ptron product because you can't get any service.....also product quantity also very poor,Worst product waste of money,0
1,"I regret buying these earbuds. Even boat and realme lower segment earbuds are better than these. Don’t waste your money buying these earbuds. Sound is very low, battery backup is poor, design is too heavy",Very cheap earbuds from JBL,0
1,"Very Low Sound Performance,",Very Bad Itam,0
1,sound is decent but battery dies pretty quick using them for month backup reduce drastically,NOT GOOD AT ALL,0
1,product is very poor and it is a waste of money to buy this.,Prem,0
1,Battery life very poor and mic quality also very poor 😢 loss of money,Bad product,0
1,Do not buy this product . It has manufacturing defect . And they don’t take return . And Amazon just takes its commission and keep silent and doesn’t support here.,One of the ear bud doesn’t charge.,0
1,"Quality is so bad , mic is not working from first day",Fraud,0
1,Volume  has not good  compare to other brands,Volume  issue,0
1,No bass boosted,Worst product,0
1,"This product in not stall working . Tried my level best contacted their customer service but their lip service did not work. I am fed up with this product. Please take it back ‘ replace with simple ear buds. If you don’t take back, I have to throw them into dust bin. It is an utterly useless product.",It is a useless product. There is no Customerservice/ help,0
1,Received only charging caseEarbuds missing from packetHighly dissatisfied with service,Missing parts,0
1,"Battery life is hardly for an hour... Worst experience with JBL.. First with pulse 3 now this.. Bought oneplus bullet z2 and that's cheaper, durable in every aspect better than jbl.. Won't recommend to anyone..",Battery issues from beginning,0
1,"The media could not be loaded.
                



I purchased this product in the month of August and within 2 month its right side bud stop working completely... Connectivity is too late.",Right bud is not working,0
1,This earbuds won't connect properly  and there will be a sound in the  earbuds  like that was very annoying while playing music it will disconnect it self without any control from your money or the earbuds  Rather than buying this brand product buy Boat products it will worth it,Such a cheap product,0
1,Kam nahi kar raha hai,Bat sahi se nahi ho rahi,0
1,I am fan of JBL also Amazon is the most buying platform for me. After receiving this product I have immediately raised for return concern as I get fit issues in my ear. But unfortunately I was told that return is not possible. Now it is showing return & replacement policies over. It is now no use for me.,Not satisfied,0
1,Poor quality product. Don't buy it.Customer service is not good they didn't reply fast.,Poor quality,0
1,I use this product 2 day’s but there is i found noise cancelling is not good always you face outdoor sound problem. So I suggest you don’t purchase this product.Amazon never return this product they asked me to we are never replaced this product they cannot help.,Don’t purchase,0
1,Amazon replacement service very very worst,Left Ear bud not working,0
1,Very bed product after 3 month left side earbuds automatically switch off or not work when open after 5 seconds switched off,pt.arvinddabral@gmail.com,0
1,Big ear buds but no grpa so bad,Big ear buds,0
1,"In just a week earbuds is not taking charging, this is very disappointing from JBL brand",Ear bud snot charging,0
1,"Pathetic quality, expensive for free as well. Disappointed.Don't buy.",Sound quality,0
1,Sound quality and volume very low may be this product already defective.Never ever buy this product in Amazon and any productZero support from Amazon side,Worst product JBL 245 NC and Amazon service 👎,0
1,Poor product,Does not power on,0
1,Hi I have one plus ear buds and compared to it i see this product is very low in performance.. not adviced for music lovers bass effect is not good in this product.Really disappointed,Bass effect is not as expected do not recommended for music lovers,0
1,Don’t buy this product. This stopped working in just 6days. Worst purchase,Worst buy.,0
1,When i first received the product the right bud was not working and now this product i received is in used condition there are scratches all over the case and product is dirty and used. Plus there are missing accessories that is a user manual and USB cable,Received used product with missing accessories,0
1,Dislike,Dislike,0
2,Sound quality is good. But there is no bass. Low notes are not audible. Does not rest in the ear properly. Not worthy enough for the money,Sound quality is good.,0
2,"The worst noise cancelling feature. It doesn't cancel background noises, only decreases a bit, but for the other side of the call, recipients can hear the background noices clearly. So, not worth it in this price range.",Noise cancellation feature not working,0
2,The environmental noise cancellation feature is missing. The person on the call will hear a lot of noises.,Voice call clarity is very low,0
2,Product was not working properly,One bud not working,0
2,Sound is very low no baas,sound Quality is very low,0
2,"Not worth it, u can get better sound quality in this price range from realme , OnePlus , this product of jbl not upto their standards",Expected better from 245 nc,0
2,Bass was perfect..but sound very less…when ur watching a movie sounds ok..but u have to lesson heavy sound music u gonna disappoint,Low sound,0
2,"Sound quality is not good enough, battery drains after 3 time full charging. No ENC at all. Touch function of volume increase or decrease won't work when we use only 1 bud. Over all dont buy this. And the slide thing not good.",Dont buy this thing,0
2,"बहुत ही खराब प्रोडक्ट है। साउंड काम है लेकिन साउंड की क्वालिटी अच्छी है। ANC ठीक से काम नहीं करता है। बैटरी बैकअप कोई खास नहीं है।बेकार है ये दाम के अनुसार।इसका दाम 2,000 तक होना चाहिए।",गुणवत्ता,0
2,Charging is pure only 20 minuets working,Charging,0
2,Don't connect charger. Not charging. too many times.,Don't connect charger,0
2,Magnet of the tws box is very poor. If I shake it open automatically. It's not worth.,Magnet of the box is very poor,0
2,"the sound quality is good enough for quick calls or meetings on the go but this is not made for listening to music , the bass is to overpowered and mid and high are not cleary defined ( with reference to air pods pro as benchmark for testing ) - support me @ nomimore.org","Sound Quality is very bad, battery is good, comfort is good",0
2,"After some days of usage, the earphones will not turnoff even though they are inside the case and the lid is closed.",Connectivity issue,0
2,"after using sony, oneplus, and normal earbuds, this product is not worth 5k.  It has lag, its slow, 6mm drivers are very low and weak, have used other 6mm drivers earbuds, this is not worth the price.",not worth 5k,0
3,Bass quality best but i use under 15 days oldBuds air 6 pro left side not workingI am canfuse ye teal hai ya fake,Realmi buds air 6 pro,0
3,Nyc product good quality,Buds,0
3,Packaging ase thi jase phly use kiy huey ho dono box already open ty so next be careful,Volume bhut late ati hai or volume bhar ati hai,0
3,Battery life not good 😕 It is said that the battery will last for 40 hours but it only lasts for 10 hours. Combining the case and earbuds.,"Ear buds are good, sound quality is also good but battery life is not good.",0
3,"I purchase this earbud, sharing my feedbackPros:1. Sound quality is good.2. Majorly my focus was mic, I have purchased two earbuds before but their mic quality was not good. so bought this one. I found its mic quality very good.Cons:1. After using it for 1 hour, it's pain in the ears, and its size is not appropriate. Not comfortable in ear.2. Battery time is too less, continuous use of 3-4 hours, it goes down.3. I wasn't expecting these cons from Samsung so it seems overpriced.",Overpriced and less battery with big size,0
3,"I have used galaxy buds 2 that’s quality is better than this galaxy buds2 pro.Sound Clarity is not good, not value for money. I’m disappointed with this product.",Quality is not good,0
3,"Don't buy this product, waste of money, call noise cancellation, base sound not good",Not good,0
3,While using the earpod sound is not getting clear and very low on the full volume,Sound issue,0
3,Left side ear budes is not working and completely dead after few days,Ear Budes problem,0
3,I bought this buds after watching many YouTube videos and all praised this product but I didn't like it much. Previously I was using OnePlus buds Z2 and that sound very good if compared to this. If you like EDM or Hip Hop music you are not going to like it at all. Loudness and bass is very low.,Good but not great!,0
3,"For gym or listening to musics and talking indoors it is good to go..But for calls when your are travelling in open vehicles like bus, auto,train. Then it's a bit difficult to hear.",Average,0
3,When it works it's good but one earbud doesn't work at all,Not bad but not good either,0
3,"Amazing sound, good instrument seperation, comfortable but I am facing issue with sound distortion and it totally destroy the listening experience, I don't know if it is with only my unit or for every product. I am not happy due to this issue I tried resetting so many times but no improvement, I don't know how to counter this issue",Noise distortion,0
3,1*very bad quality2.sensors are not practical...3.sound quality is average4.difficult to control sensors...,Never buy this....,0
3,Not that great but as per price mic n sound is good enough,Okish sound,0
3,"It's a good product but some disturbance I show when I call to someone, otherwise it's sound quality bery good",Not so bad,0
3,Not as good as expected,ㅤ,0
3,"Samsung Galaxy Buds2 Pro is not compatible with Microsoft teams, and it will stop working in the middle of the callListening to music and all is good, except the issue with Teams callIf you purpose is to use in calls, better look for something else.You can refer to several complaints regarding the same over internet",Have issues with Microsoft Teams calls,0
3,"Good for calls, avg for music",Avg for the price,0
3,The sound is okayish. Bass is not that great. Lacks clarity. Fits perfectly btw. Connect instantly. Finish is good,Okayish,0
3,This is an okay productThis feels average and other buds at half price point match the quality of sound it has.I wish it had a punchier bass response.This could have been priced lower by samsung,Okay product,0
3,"Looks premium,  and case and pods are strudy,  both Apple and Samsung s23 connected seamlessly,  the tap and hold options is buggy in iphone + hey melody. No major difference between ANC and transparent mode, the voice is electrified. Not sure if this justified the cost.",Not a great product,0
3,The media could not be loaded.,Product is not good it's disconnected in one. One minjut,0
3,Sound quality is good 👍 but battary backup is not good,This whole is normal . Or manufacturer default,0
3,"Right ear bud is not working after 6 month,poor service by ptron",Not working,0
3,Voice quality is not much it should b good,Average,0
3,"honestly,very mediocre. i guess it's okay for the price? but i would rather put in 100-200 rs more and buy a better pair. i haven't tested the battery life yet but judging on sound alone it's not that good. music is not very clear. if you really like to feel the music, you'll be disappointed by these. i know I was. wish i could return these and get a refund.",mediocre at best,0
3,Very much impressed with the sound quality and battery performance.,Good one,0
3,Sound quality is good and design also super but one thing battery is not suitable for this amountI am not prefer to buy this item for othersI am listening a music for 1/2 hr it will reduce from 100% to 85%My preference is redmi buds it will listening a songs for 6 hrs battery percentage is 100% to 88%,Product description l,0
3,"I am a regular user of oppo enco x2 pro tws and bose qc35 ii over head,Its in comparison to both,Hands down, oppo enco x2 pro is the best ive tried.Best anc, best audio output,Galaxy buds 2 pro dont come close to those.Range is avg, audio and anc is okish,And they dont fit my ear ( every reviewer said the best fit)Overall disappointed.Ps. Also a user of galaxy buds live, they both sound same.",Not the best 😕,0
3,Good,Nice,0
3,"It may seem good in pics, but it's not as comfortable and it's sound quality isn't so good. But for the price it can be used.",Its comfortability,0
3,Value for money,Value for money,0
3,Low Sound,Low Bass,0
3,Loosing connectivity... Not good,Not worthable,0
3,Cawalti no good,Batare cawalti loo,0
3,Sound is good . Calling quality is also good but size is small.. ok go fot it,Good,0
3,It is good but little problem while hearing,Cannot hear properly,0
3,Average earbuds not too much good..and sound bass also... average I will not recommend to buy..,The earbuds are not very good,0
3,Good,Good,0
3,Not good as expected though the sound quality is excellent,Battery drains,0
3,Ai not working properly that's ptron I2203Delivery properly that's product Ai not working properly this is only reason to return this ptron product one side ear buds working left side ear buds working but Right side didn't working properly,One side ear buds working another ear buds didn't working Ai couldn't connect,0
3,"Buds2 pro connect to moto edge30ultra in LE audio mode - 24 bit LC3 codec, which is supported but if anc is off it makes stuttering sparking sound in both buds, also buds connect to Bluetooth as 2 seperate devices in group, HD audio - aac codec mode worked ok-no disturbing sounds. Bluetooth 5.3 might fix the issue or maybe a Samsung flagship phone. Compatibility is not great, comfortable, durable, in hand feel is great but doesn't feel the value for money.",This wasn't expected,0
3,Need replacement it’s under warranty till 2025 it’s not working properly,Replacement,0
3,Good product,👍,0
3,Product is good but active noise cancelling is not that of good quality.,Product is good but active noise cancelling is not that effective,0
3,"360° spatial sound and 24 bit hd audio is hilighted feachure that will not support in non Samsung phones. That is a big drawback, that's why giving a huge discount.",Most feachurewill not work in non Samsung phone,0
3,"I am using it for 2 days, its battery backup is very good, but its sound quality is not that good, if you want battery backup then you can buy it, but its sound quality is not good.",OnePlus Nord buds 3 pro,0
3,"Build quality should have been developed bit more, but it's okWorth for the money!!",Nice 🙂,0
3,Prize kaafi jyada hai but in the real sound without eco hai...like wire leads sounds,Product,0
3,Build quality need more and not audible clearly,Good,0
3,Good,Anilbhai Vasava,0
3,"I already have sony ear buds. After hearing the hypes I ordered this . I usually use for tv audio. Bluetooth connection good. Ear fitting good. Audio anc good with right plug. Audio experience is average. Fitting in the box not easy. We have to maneuver. In sony better audio experience and replacing in the box is so easy, with perfect magnetic fit. May be a better ear buds with samsung phone as other reviews mentioned, I don't have one",Not upto expectation,0
3,Sound quality,Sound good,0
3,Good sound clarity but I have a problem when charging sometimes.,Good clear sound,0
3,It's better,10 minits.  Aftter.  Atomicatake ga ist shutdown,0
3,"Good for money.Bug it completely blocks your ears ; you can’t co hear anything going on outside . Doesn’t fit ears well . Otherwise sound and base are perfect .But if one earphone is placed away and only one is used , the other person can’t hear you speak.",Average,0
3,"The media could not be loaded.
                



When I compare it with OnePlus, noice cancellation is poor.",Noise cancellation is poor,0
3,Not so gerat quality,Ok,0
3,The sound quality is not worth the trouble that I went through when I bought these. The first product I recieved had hardware issues and for a moment I thought they are gonna explode in my ears literally. Thankfully Amazon gave me a quick replacement so hats off to that.,Consider these as the last options,0
3,Office usage okay. Otherwise is not fit to travel.,Sound quality average,0
3,"Design ok, battery back ok, but connectivity issuesWill come",Average,0
3,"Totally disappointed 😔If you play song on loud volume, person nearby you, enjoy same like you",Totally waste of money,0
4,Average,Not happy,0
4,Sound and. Bass quality is very good battery life also very good 👍🏻 nice looking nice 👍🏻 and. Most important performance is nice but 0.3 sec paly bake. In touch buttonApplication is good but more impure in future waya update all good burd in this price point all so bye it,Battery life,0
4,Good 👍,Good,0
4,Great for calling and music. Noise cancellation and comfort could be improved.,Value for money,0
4,Good one with good base and notes. little bit of distortion while on calls. Not suitable for Bluetooth which are older version ..4.0 or before 4 as lot of distortion with my Laptop connection which has 3.5 BT version...where as other buds are OK...Should have offered App control (Customizable) touch control...else So far So Good...using it for more than a week...,Value for Money,0
4,"Product is decent, compare to quality, and sound is also good",Best...,0
4,"Sound quality, battry backup..Overall good product",Great product.,0
4,Amazing experience,Sound clarity,0
4,The ear buds are totally awesome they look and their voice oh my God,Satisfied,0
4,Sound quality is good,Nice product,0
4,"The product is really good the sound system, it's features, button function etc but major problem which I am facing is their charging issue. It takes 2 hours from 10 to 100 percent and spending more than 4000 it is not worth it so if you are okay with charging issue you can definitely buy it.",Ita battry issue,0
4,one ear bud not working,ok,0
4,Value For money must buy if you looking under 1200 Rs I will Edit review after one month use for now this is very good to buy this eaerbuds way better than boat and other brands 4 star for build quality issues you have to use cover for white colour,It's Amazing,0
4,Every thing look very good and nice.It is one of the best product of cross beatYou can go for it.,Wonderful,0
4,It does not need charging in 10 to12 I did not charge it in 10 to 12 days it is medium in fitting durability is too good fit size is also good cancel noise is80% durability warranty is good,Oneplus nord buds 2,0
4,Great performance and syncs well between laptop and IPhone. No ANC while using with laptop.,Good product but no ANC while using with laptop.,0
4,Sound not clear During bike helmet use,Mic issue during Bike riding,0
4,Just go for it guys it has a best sound quality ❤️ and very smooth bass 😍 one plus product's are always banger 💥,Best....,0
4,i like it's sound.,best product,0
4,Nice product and quality,Nice,0
4,"Nice sound,bass quality also good",Quality product,0
4,Very useful and worth every penny,Very good product...,0
4,Atom is very good product,Very good,0
4,I like packaging and also sound quality,Sound is much soft,0
4,Product is good.,It's a good product.,0
4,A very good product and is the best under 1500 but I gave 4 stars because I did not recieve in the package. Not issue with Amazon but issue with company. But overall I had the BEST experience with this product,Warenty,0
4,Backup is average,Good sound quality,0
4,The product is good and have multiple features.,Good Product,0
4,Product is good in price,Base music calling is good,0
4,1. Fit in ear is good.2. Very light weight3. Sound quality is nice (tune as you like!)4. Easy to find (alarm)5. Reasonable battery life.6. Touch functionality is bit tricky! I'm not comfortable. Single/double/triple taps always gets mixed up 😮‍💨,Nice TWA headphone!,0
4,Good,Not so good,0
4,Awesome...!!!,ANC,0
4,Sound effect is minimal. But you can download an exclusive Bluetooth App and enjoy. Operations are usee friendly. Comfortable to wear. Battery life is sufficient.,vijayjagadeesan@gmail.com,0
4,good product with good quality and comfortable fit in the ears and sound is delivered by these earbuds by crossbeats,good product,0
4,This product is awesome as always. I got it from sale today,Quality,0
4,"It's super earbuds, bass music and calling super, i have used it indoor and outdoor calling, it's super and i used it at bus, it's amazing, ANC AND ENC reduce 90%, especially bass and calling super duper, earbuds battery backup also good if turn off ANC (7 to 8 hrs) with ANC 4 to 5 hrs in  upto 50% volume, if the battery drain fast, reset it",Super excellent,0
4,,No warranty card,0
4,Sound quality is best with noise cancellation. Cool appearance with good fit and connectivity. Only one thing is missing that is you cannot connect multiple device. If you want to switch to another device then it has be uninstalled in first device.,Best performance with noise cancellation,0
4,Accordingly going with price,Good product,0
4,good,good,0
4,This product is very useful,Useful,0
4,Good quality,Nice,0
4,The media could not be loaded.,It's good 👍,0
4,"The video showcases the product in use.The video guides you through product setup.The video compares multiple products.The video shows the product being unpacked.Video Player is loading.Play VideoPlayMuteCurrent Time 0:00/Duration 0:09Loaded: 33.37%0:00Stream Type LIVESeek to live, currently behind liveLIVERemaining Time -0:09 1xPlayback RateChaptersChaptersDescriptionsdescriptions off, selectedCaptionscaptions off, selectedEnglish (Automated)Audio Trackdefault, selectedFullscreenThis is a modal window.


Battery life is good, sound is really good, In-ear fit is great, doesn't even hurt after long day of use.Active Noise Cancellation is average.For the price its great",Good enough for price,0
4,Excellent,Ok,0
4,Right side is not working,Product not working,0
4,Average quality,Average,0
4,Good product,Good,0
4,It's good . you can purchase it . it's worthy,Good,0
4,The best product in its category for this price range (i got this for 1500 INR) . ANC is suprisingly good only thing i did not like was the stickers 😂 . Transperant and bad glue very cheap. Remember noise a chain is as strong as its weakest link.,VALUE FOR MONEY,0
4,Product quality good and design good,Design good,0
4,Durability,Sound is poor,0
4,"_Noise Cancellation & Mic Issues_- Noise cancellation inconsistent, sometimes switches to Transparency mode automatically- Microphone quality not good, especially in noisy environments (trains, buses)- Sound quality experience extremely super but noise cancellation & mic need improvement- Gaming mode is okay, but could be better_Expected Better at This Price_",After using 2 weeks,0
4,Cool Active Noise Cancellation,Good,0
