rating,review_text,title,helpful_votes
5,"Boult earbuds are a solid choice for anyone looking for affordable, reliable audio gear. They strike a good balance between performance, comfort, and price, making them a great option for everyday use. Whether you're a casual listener or someone who needs a decent pair of earbuds for workouts, Boult is worth considering.",Nice product,0
5,Good battery backup . Sound quality is awesome. Background noise is not heard on call.,Best earpods in this price range,0
5,"Want improve your sound quality some more , good battery life .",Slide TWS,0
5,In this price segment pretty gud and stylish earbuds by cross beat this my second earbudFirst one is Fury and now this must by product,Stylish and powerful,0
5,"The Ptron Bassbuds duo is totally value for money, providing an impressive audio experience at a budget-friendly price point. They excel in bass reproduction, making them a great choice for bass lovers. The design, comfort, and battery life are commendable..",Nice earbuds,0
5,Worth buying. Crystal clear voice call. Look & other specs are working classy,Such a beauty,0
5,I liked it's featuresIt's micIt was fit  allService was niceIt connected fast with OnePlus phoneIt is best for daily use,It was the best product from Amazon.,0
5,I liked how the product is light and my ears don't feel heavy considering it's size the sound quality it gives is amazing and the battery lyf is good too,Light weight and lovely sound quality,0
5,"(Note- I am using OnePlus 12R. So ecosystem works. Music experience can vary device to device.)First and most important thing for a headphone or buds is its music and voice quality. Its just perfect 👍 for the music lover. Bass is smooth, Treble is perfect, clarity is outstanding 👌. You can literally differentiate between instruments while listening music.Connectivity is fast and snappy on OnePlus devices. Mic clarity is great on calls. Battery is satisfactory.You can go for it without a doubt.👍✌️😎",Outstanding✌️Best In Class😎🎧,0
5,This earbuds have very comfortable and easy to use and noises cancellation is to good and quality is niceand size are perfect for every ears,I have happy for my purchase,0
5,"Boult earbuds offer excellent sound quality with deep bass and clear vocals. It's comfortable, lightweight, and have impressive battery life, making them perfect for music lovers on the go. Highly recommended!",Money worth it,0
5,"Excellent sound quality with deep bass and clear highs,Long battery life, Comfortable and lightweight,Customizable EQ settings via the app. Design is really appealing as well.",Good Product and Sound,0
5,Good Noise cancellation best audio quality best earbuds in this price range,Outstanding Performance,0
5,"Budget friendly buds in such a price rang , ease of use , to comfortable, good quality, with primium looks , fast charging support",Budget,0
5,"For 3400 these are the best earphones i have ever had .. clear treble , have tweeter effect and I am enjoying this music .. i have 1+ 12 may be thats the reason of it gets soo well with the phone .. but best buds till now .. very happy with them ..",Amazing buds soo happy with them,0
5,Awesome Bluetooth headset with noise cancellation upto 49db if I am not wrong.We can connect 2 device and use simultaneously.Bass and sound clarity is decent. 40+ hour of battery backup.Totally worth it for the price.,Awesome headset with decent noise cancellation,0
5,"I am using samsung s22 ultra and I thought of buying samsung buds 2 pro or 3 pro, But those are ridiculously expensive and for me those are not at all worth it. My usage is minimal and listening good Music. I used friend's samsung buds 2 pro but compared to this I will recommend oneplus buds 3 over those. I felt really amazing and good ANC and dual pair connectivity.  Overall I got it for 4k deal price and it's worthy.  go for it incase if u want a good product under 5k.",Best Tws Under 5k,0
5,"Great sounding ear pieces, so much enjoyable even outdoors. ANC is must have technology.",Stellar sound and fitting (slightly intrusive),0
5,"The sound quality and bass are good. It's budget-friendly with a sleek design, and it's compact enough to fit easily in your pocket. Overall, it's a good product for its price",Good Quality for the Price,0
5,"The media could not be loaded.
                



The Boult K10 earphones exceeded my expectations in every way. The sound quality is crisp and immersive, with strong bass that enhances the listening experience. I also appreciate the comfortable fit – they don’t slip out even during workouts. The build quality feels sturdy, and they’ve held up well through daily use. Battery life is great, easily lasting through long commutes or a full day at work. Overall, these earphones offer fantastic performance and durability at a budget-friendly price. Definitely worth the purchase!",Impressive Performance and Durability!,0
5,The sound quality is amazing in that range drivers are amazing have clear sound at full volume having amazing design overall buds are good,Sound,0
5,"The sound quality is good, and the noise cancellation works well. You should definitely buy them at this price.",The best Bluetooth earphones under budget,0
5,Product is really good & good sound quality  of product,Quality  is a good,0
5,"The media could not be loaded.
                



Today i received this product and delivery is so perfect and nice also packing is good, this buds case is compact and overall good and buds also fits good but i feels the earbuds grips is not so much well, at upper and lower stain of buds is few curves.. but the sound and in-hand feel is amazing 😍",That's really feels premium and very amazing sound quality..,0
5,Yesterday I have received the product I liked the product I'm using it if any challange I will come backThank you so much,Crossbeats,0
5,"I've been using the OnePlus Buds 3 for a few weeks now, and I'm thoroughly impressed. The sound quality is fantastic, with clear highs and deep bass that really enhances my music experience. The active noise cancellation works surprisingly well, blocking out distractions whether I'm at home or on the go.The fit is comfortable, and they stay in place even during workouts. Battery life is also impressive—I can easily get through a day of use without needing to recharge. Pairing with my OnePlus phone was seamless, and the touch controls",Excellent Sound Quality and Comfort! nice,0
5,Noise cancellation was very good and quality and looks are nice,Excellent,0
5,"The sound quality is good at this price, Looks & Design are also good.",Good Product,0
5,"The Boult K10 Truly Wireless Earbuds offer great value with up to 50 hours of playtime, making them perfect for long usage. The four microphones provide clear call quality, while the 45ms low latency is ideal for gaming and video watching. With Type-C fast charging and an IPX5 rating for water resistance, these earbuds are well-suited for everyday activities. Overall, they deliver solid performance at an attractive price point ✨",Review of Boult K10 Truly Wireless Earbuds,0
5,first of all the design of this product is beautiful and so smoothand the sound signature was so nice even without any kind of tuning or adjusting the vocals and seperations .noise cancellation works soo good and accurate360 spacial audio not that perfect but still the voice punch and bass were well maintained by realme and at this price range(4499) this product is a killer compared to any earbuds on market i guess,value for money,0
5,"The Boult Audio K10 wireless earbuds offer impressive sound quality, comfort, and a sleek design at an affordable price. With 5-6 hours of battery life and stable Bluetooth connectivity, they’re ideal for daily use.The lightweight build ensures comfort, making it perfect for long listening sessions.",Good Quality,0
5,Good Build and Music very Pleasant,Appearance,0
5,"Light weight, easy to use and what a battery life. Built of the pods is too good. Fell down 3 times but still working well. Wow",Works well - both looks and performance,0
5,"This is overall nice product in overall functioning including battery back-up, voice pitch, sound quality. I recommend to buy this product..",Awesome product at all,0
5,"I can not believe how wonderful this product is; the features also function on my iPhone, iPad, and MacBook. I would highly recommend it, especially to those who use iOS devices, as the earbuds' functionality is identical on both Android and iOS devices. Overall, I give it a five out of five rating.",Just go for it,0
5,"Overall good product, noise cancellation and extra bass are key features. Club it with hey melody app on phone for best experience.","Noise cancellation works fab, do download the hey melody app for best experience",0
5,Sound quality is superb,Sound quality is superb,0
5,Good build quality and good quality sound,Build quality,0
5,"In this price no any product beet it's sound quality,connectivity , fit ,touch control, charging and design.",Very good product,0
5,Best earbuds under 5k,What a nice product,0
5,"bought boat nirvana before this and had to returnOneplus is simply amazingboat can never create something like thisbest value for moneyawesome controls, sound quality, and connectivity",simply awesome,0
5,Sound quality is awesome,Good sound quality,0
5,All functions are goodLook wise very goodPrice is fair,Good,0
5,This is good product and it's worthy,Worth buying,0
5,"Great sound quality, design is good and functional, Very easy to use and connect, warranty also covered , immersive sound experience and connectivity",Amazing,0
5,Good sound with a little more bass and good battery backup,Worth the price I bought it,0
5,"Too happy with the sound quality and noice cancellationAnd important to tell about features like , volume up and down if we slide finger on bud love this feature thnq OnePlus for this beautiful product",Must buying product,0
5,NC is awesome but value for money,Must buy,0
1,"The product is underwhelming; the right earphone produces significantly less sound than the left, even with the equalizer adjusted. Additionally, the overall sound quality remains poor despite maximizing the volume on the phone.",New Product  is not up to the mark,1
1,I bought this for 4.5k in July and currently it's retailing at 3k on Amazon which should give you idea how bad this product is.JBL has a super confusing and mixed models line up when it comes to TWS and on top of that you will always see moxed model/country reviews on Amazon on all its products.In merely 2 month of use I had to visit the service centre as sometimes right or sometimes left earpiece wasn't charging and the connectivity issue was at par. Even if you close the buds in case they won't get disconnected which is super frustrating.On top of all these issues the core aspect of earphones ie Sound Quality is also not at all satisfactory and has a super low volume.I got a replacement with similar issues still persisting here and there.Regret buying this JBL TWS (My first and last). Big time disappointment as I bought this out of likeliness to my experience of Tune 230 NC at a Samsung store.,High Expectations - Pathetic Product,1
1,"Not so good,And jbl service is very bad . I have used only for 1 week and after this mic was not working. Now it's more than 20 days . I didn't got the new product. Thank you",Not so good,1
1,There is no return policy...Low sound...bass also not good poor quality...today right side bud not working permanently.... don't waste u r money guys...buy only offline it's better...,Don't buy..nd Amazon service is also terrible,1
1,I have had 4 products of JBL in the past and got these earpods as the 5th which cost 6k but it isn't even worth 1K... sound quality was ok...but it started giving battery issues very soon (dies in half hour)... service centre cleans and gives but they hv no idea what the problem is... And they say since I went to them 20 days after warranty is over they can't do anything about it...they don't expect a 6k earpods to work more than a year...and the earpods replacement would cost around 5k with a RIDICULOUS one month warranty...I went back to using my old BOAT earpods which cost 2k and they are still working perfectly even after 3 years...Also Amazon had sent these JBL earpods which were registered in someone else's name when i received them...they were not in factory reset which I got done by service centre... Amazon claims the box was sealed so brand new... JBL store feels they seal all returned products without solving the issue..I don't know who is at fault more but JBL is certainly WORST AFTER SERVICE and Amazon CANNOT BE RELIED UPON FOR EXPERIENCE ELECTRONIC PURCHASE,Worst JBL experience!,1
1,Very Poor Battery Life and after warranty period no repairing or replacement available. When contacted company for the same they shamelessly says that nothing can be done and can offer coupon of 15 percent off.,Worst Customer Support and No Repairing Avaialble,1
2,"The media could not be loaded.
                



Major issue is case lid opens unnecessarily ...Also open up when in pocket so i have take extra care of case",Not satisfied automatic case opens everytime,1
2,Sound Quality is very bad,Bad sound quality,1
2,"Serves the purpose of a bluetooth headset. However, it is ipx4 rated and not ipx5 as advertised in the amazon title. Moreover, there are no additional cushions for the earbuds to fit as per ear sizes. The charging and battery life is good, but overall the things that are missing from the package is just a disappointment.",Average,1
3,Sound quality is not as expected. Not satisfied with the product,Sound quality,1
3,Music sound and clarity is good.Earbuds are bit large and it is painful to wear. Most of the time can’t wear it for more than 20mins.Application features are good.Mic quality is i good rarely there is problem.Hinges are not good as lime in AirPods but when you hold it you can easily wiggle it left and right.,Good sound quality but Earbuds fit are painful.,1
3,Almost value for money product. Sound quality is excellent. Battery backup is average. Call quality in ANC mode is poor. Disconnect several times during use and reconnect automatically in few seconds.,You can buy if they resolve the issues.,1
3,मुझे डिलीवरी नही मिली हे और ना हि रिफंड आया हे और नाही रिप्लेश हुआ हे..आपकी सर्विस बहोत हि खराब लगी मुझे..मेरे साथ फ्रॉड हुआ हे..प्रोडकट डेमेज हे और कुरियल वाले ने लेने से इंकार कर दिया और कम्पनी कस्टमर केयर से रिक्वेस्ट नही आयी रिफंड की..,Items is damaged,1
3,Some time sound cuted when moving Neck.,Some time problem,1
3,"I have used oneplus buds 3 that is better than this one, ANC also is better in the buds 3 but in 2295 nord buds 3 aren't bad at all, if your budget is limited then go for it",The product is good,1
3,Is gadhe Samsung ko headphone me 3d ko bhar bhar kar adverte kiya par usko activate karne ke liye Samsung ka mobile lana padega. Or 100% feature use nahi kar sakte to sony kyon na le. I used both sound of sony is also good. And more options are there in similar price.,Pata nahi kyon five star mile hai,1
3,"Other than the Sound Tuning everything else is plausible on Oneplus Buds 3At this price idk some spark is missing in them despite having 2 drivers.The Staging? V shape? Idk its not Natural, too digital... There's no fullness , No crunch. No spread. (yes there is Bass but then treble isn't balanced and around 1K there's something missing)With that price tag I 👏 expected more.Now im ruined by IEMs ,also i have Beyerdynamic DT 770 and i think I'm comparing a TWS to them. 🤦‍♂️No doubt nothing can beat wired earphones.But OnePlus buds 3 could do better in Sound staging",Okay in Sound. Best in Controls and connectivity,1
3,Unable to charge as usb cable stopped working in less than 2 weeks. And the return/replacement window is now closed.Can someone please assist?,Usb cable is not working,1
3,Bass is not good,"Average , not worth",1
4,"This earbud supports Ldac codec, so sound quality is crisp and clear, and battery life is good Not best.When noise cancellation mode is on and Ldac mode is on then battery drains up fast.You have to download realme link app to customise earbuds and to turn Ldac mode on.Build quality and finishing of this product looks premium If you're getting these buds under 4K, then go with it without any doubt.",One of the best purchase under 4k,1
4,Earbuds is Good built quality is also very good.Quality of sound is excellent bass is also.,OnePlus Nord Bud 3 Pro,1
4,Case is small but it is goodBuild Quality 7/10Sound 9/10Comfort 8/10Battery 9/10Noise cancellation 6/10,Good,1
4,"The earbuds are a fantastic choice! They offer excellent sound quality, a comfortable fit, and impressive battery life. With quick charging and clear call quality, they provide great value. Highly recommended!",Just Amazing!,1
4,"The media could not be loaded.
                



I got it at discount price of 2799 which is a very good deal. But above 3500, I will not recommend it. I used boat nirvana ion before which is also good one.Pros:Good looksLdac audio qualityFeature richCustomizable equilizer optionsCons:Bass output is a bit low, need to tweak in equilizer settingsExpensive at current price of 4500A bit hard to remove buds from caseBefore using App, it needs your phone/email information and app experience should be improved.",Good feature rich sound quality,1
4,"Overall the tws is excellent wrt to its price but the main issue I found was that it does not support dual pairing. For people like me who use laptop and phone side by side it's a bit inconvenience as I will not able able to use it efficiently. If I have to connect to laptop then phone gets disconnected, it's kind of a problem but may not be for all. Earlier I had a boat neckband which had dual pairing support and I had a habit of that. It's not a very major problem but still, it should have been made proper.",Sound quality is very good but no dual pairing support,1
4,"The video showcases the product in use.The video guides you through product setup.The video compares multiple products.The video shows the product being unpacked.Video Player is loading.Play VideoPlayMuteCurrent Time 0:00/Duration 0:09Loaded: 33.37%0:00Stream Type LIVESeek to live, currently behind liveLIVERemaining Time -0:09 1xPlayback RateChaptersChaptersDescriptionsdescriptions off, selectedCaptionscaptions off, selectedEnglish (Automated)Audio Trackdefault, selectedFullscreenThis is a modal window.


Looks good & fashionable.","Loved this SLIƊE, good product in this segment.",1
4,"It is a superb product, the only improvement needed is that the volume up and down should have been work through a touch sensor.",Review after use,1
4,Hey guys i have been using it for approx 1 month I want to give u guys a good review the main thing is the quality of the hinches are not atmost quality it's ok ok quality is good app is not good it's terrible and the anv is good overall it's good only problems are the hinches and the app,Good but,1
4,"I had oneplus neckband since 2 years its still working but now i bought airpods.. n its so amazing.. about functionality its super.. it has sensor so u can pause or change songs by just tapping.. bluetooth connectivity is good also u can use one earbud at a time.. As m super sensitive, earbuds hurt my ears, if i use even for a while.. this one is really comfy for my ears  I'll add other features eventually after using it.. now come to the durability i bet one plus is trustworthy cz m the loyal customer of one plus since long.. also thanks to Amazon delivery got my product safe and on time👍",Comfy for Ears,1
4,"I bought this realme T310 in amazon sale after reading reviews and youtube review videos,In my case i want to clear some myth's,1.i read that realme link app doesn’t work with iphone - its works perfectly in my iphone2.its not charging properly and sometimes one side earphone not working- mine works perfectlyThis TWS is very light weight and i loved the fitting you can sleep with wearing this without any problem",Genuine review,1
4,Earbud sound quality and call quality is fine . Noise cancellation is just nominal. Dont compare it with Bose or Sony. Anyways price is also not comparable. Hence itne me itna hi milega wali baat. Overall for 2000 it is fine. Not sure how it compares with INR1000 earbuds. But i guess look for the driver size and not for noise cancellation in below 10k earbuds.,Okish,1
4,Very good sound. Only not understanding the worth of using talk through feature because it works even in fan sound. It supports AAC codec as shown. Recommended.,Very good tws,1
4,,Good value for money,1
4,"1)Buds music quality is too good.2)Touch controls fuctionality for volume, ANC on/off, music mode, game mode are really make it convinient to use.3)Looks are stylish.Note: There is a scope to improve conform into ears.Overall very good product.",Good Quality EarBuds...Happy to have it.,1
4,Nice sounds quality,Nice product,1
4,"Pros:Music quality and bass is like expensive earbuds. Blind compared these with oneplus buds 3, very minimal difference.Build is solidVery compactFind my earbuds works wellCons:ANC doesn't completely silent your environment. Speech, music and sudden noises still get through. Fan noise is also only halfway blocked.By default it starts with transparent mode, on call also it goes to transparent mode, which makes you hear your own voice twiceThe options for touch control are very limited",Good for the price,1
4,"I buy t300 in 1700/- it is best in sound quality,connectivity, bass,vocals, app support ,finishing,design,battery backup, and anc or indoor calling is okay. Bad points 👉 build quality and fitting in ear is not good 😐, there are no single touch control , major problem is outdoor calling.",Build quality and calling is poor.,1
4,"The media could not be loaded.
                



Good earphones with stylish earphones cover in this affordable range. Bass is also good. It is loud and clear. Totally recommended to buy this product","Crossbeat slide, a good earphones.",1
4,Awesome sound quality. Only absent I'd dual device pairing,Nice,1
4,I'm writing this review after  10 to 15 days use ..Sound Quality - 3.5 out of 5 I didn't like the audio quality muchComfort - 4.7 out of 5Call Quality - 4.5 out of 5Style/ Design - 4.5 out of 5Noise Cancelation- 4 out of 5Battery- 3.9 out of 5 but they support fast charging so won't matter much,Good for price ranged max 1800,1
4,"I use Galaxy Buds2 Pro with my iPhone XR. Sound Quality, Build quality is awesome. ANC is not so good as compared to Apple AirPods Pro 2. Overall Good product.",Good Product,1
4,Just awesome sound quality touch is not proper allover good one,Product sound,1
4,"Noise N1 Pro Buds ReviewThe Noise N1 Pro Buds deliver impressive sound quality with rich bass and clear highs. They’re comfortable for long wear, thanks to multiple ear tip sizes, and offer excellent battery life, with about 5-6 hours on a single charge. The Bluetooth connection is stable, and touch controls are intuitive. The build quality is premium, with a sleek design and compact charging case. Overall, these earbuds provide great value for money and are perfect for anyone seeking reliable wireless audio.",Noise N1 Pro Buds Review,1
4,Really like the realme buds over the oppo one. Best in segment. The ANC is good too.,Best in segment!,1
4,Decent battery life. Good value for money. Sound quality is good.,Value for money,1
4,Works comfortable with Apple Products,Works comfortable with Apple Products,1
4,"It delivers balanced sound, which is sufficient for me. However, the buds are a bit large, so your ears might feel slightly uncomfortable after wearing them for an extended period.,",Balanced sound,1
4,"I have been using oneplus bullets Z2 and I just switched to this buds and my experience is good. Sound quality is very nice , no extra bass  perfectly balance. Through hellomelody app you can change the equalizer setting if you need extra bass. ANC is not the best but good as per price. Mic quality is also quite impressive. Best under 2.5k budget",Absolutely worth 👌,1
4,"Sound quality GoodConnectivity GoodClarity during calls satisfactorySpacial audio feature really makes a difference when activated in real link appBattery backup excellentTouch control average. For next song, 3 taps are needed which the TWS many times don't respond or pauses the music as if it was double tapped.Ear ergonomics good fit. Doesn't falls of ears.Overall value for money buy. I am satisfied.",Value for money TWS,1
4,"The media could not be loaded.
                



Looks good & fashionable.","Loved this SLIƊE, good product in this segment.",1
4,"Obviously missing out on dual pairing and great active noise cancellation if you're purchasing because of that but build quality is good, sound is good and just works well in day to day uses.",Best money could buy in this range,1
4,I owned a cheaper pair of buds which had battery loading and strength indicator. Also it's possible u put these in the case and their not really charging so make sure they're both put in properly.I love the sound cancelling and ambient mode capability and overall fit and sound quality of the buds however.,Case Could've been Better,1
4,"All good but could have give extra features, but for this price it was excellent",Nice buds,1
