rating,review_text,title,helpful_votes
4,"I am using it from one month, its sound is very rich and well tuned , bass is very pure and punchy , battery life is very good, it feels very premium meterial used , its support app gives tones of control makes it performance very good , touch controls are very sensitive same time , go for it",Very comfortable and sound is so pure,0
4,"Nice sound quality , nice fit in to ear ,",Good ear buds,0
4,Sound signature is really goodCall quality is decentTotally value for moneyGo for it👍🏼,Sound,0
4,Ok ok product,Ok ok product battery backup is goid,0
4,Charge it fully and then use it.,Charge,0
4,Good ear buds. best for music lovers. heavy Bass,GO FOR IT,0
4,Pros:- The bass is super amazing.- Sound clarity and everything is just so perfect.- buds battery is decent.- Comfort is really good and good Fit as well.- Pretty durable and I bought white color which feels premium buy gets scratches as well which is normal with other buds as well who got glossy finish.Cons:- Battery of case is not really great... It feels low.- If you are serious gamer I will not recommend it.,Pros & Cons you must know before buying it!,0
4,Good product but sound is not that good,Good,0
4,Very nice ear buds,Nice,0
4,"Sound Quality: Very Good (9/10)Design & Comfort: Excellent (9.5/10)Connectivity: Bad; Sometimes Worst (3.5/10) (Except Samsung Phones)Durability: Very Good (9/10)Functionality: Good (8/10)Here I'm writing this review because of connectivity issue with my Pixel 7 phone. When it connects at first it looks everything is good but after sometime it disconnects itself without your notice and you think its connected, even worst is, it shows connected Symbol on the top but it's actually NOT. Now actual problem begins, if you are lucky enough its get connected by turning Bluetooth Off and then ON but in My case if I try to Off and then ON, it (Bluetooth) shows Connecting, Actually it won't connect at all and if you try it to off it Won't, Now I have to Restart My Phone ,what a rubbish..!! It happens Frequently... Went to Samsung customer Support they made Reset and update still No use...Still Sound Quality is Excellent, Bass and trebles are well Balanced... Even at a High volume you hear the details very clearly.Overall a Very Good Product with a Very Bad Connectivity Issue...",Excellent Audio Quality with the Worst connectivity issues (Except Samsung phones),0
4,Nice audio quality. NC is also quite well. Compact looking with premium finish. Case is very handy,Good,0
4,The sound quality is good,Great product,0
4,"But the  charging indication, problems occurs",Okay good,0
4,There is audio lag sometimes. Audio unstable sometimes when connected to TV.,Intermittent issues,0
4,Experience of listening music in traffic good,Nyc experience,0
4,Good products👍👍,Good products👍👍,0
4,"The earbuds are good they look premium even the fit is good, noise cancellation works good but you can't keep it on anc for a long time as it feels after some time paining to ear, connectivity is fast and touch control is responsive well, there are so many features in app and app ui is also good",Good earbuds,0
4,👍🏽,👍🏽,0
4,Petron Airbus was very cool... Ultimately battery life max use time 12 to 15hours..,Best battery life....,0
4,I bought OnePlus Nord Buds 2 about a week ago and I like nearly every features of the bud. Except the comfort provided by the buds. Left side bud are perfect but the right bud hurts in a ear after about 15 min of use...Same issue was also with OnePlus Nord Buds 2rI am expecting that it will stop hurting after few days... Let's hope for the best,Feature are amazing in this price range but comfort is not so good...,0
4,Need some more updates,OnePlus buds 3,0
4,A very good product1. Easily gets connected2. Clarity in voice - both incoming & outgoing3. Easy to handle4. Good battery lifeCon:1. Could have looked better2. Need to increase volume of mobile for same level as of mobile,A good product,0
4,Good,Nice,0
4,"Best earbuds under 2k, sound quality is awesome,",Realme t310...,0
4,Good quality,Good Sound clarity,0
4,"When we focus on our gratitude, the tide of disappointment goes out and the tide of love rushes in.",Quaility,0
4,The media could not be loaded.,Good size,0
4,"This is an in-depth review of the samsung galaxy buds 2 pro. At the time of this review they are on sale for 6.4k with bank offers. The real question is are they still worth it for this price (the best low price I've seen them at)?Well the short answer is yes if you are getting it at the deal price and may not be worth to everyone if the price is above 10k. It has it own strengths and weaknesses. Do read this lengthy review which I hope will help people decide properly and not just jump at it looking at the deal price thinking they will get the best flagship tws from samsung.First things first, the moment you connect the buds 2 pro to your android phone, if that phone is a mid range phone like the samsung m series or an A series then don't expect a magically transformed music experience. You will need to set the eq mode from the galaxy wearable app to dynamic to get the best from the tws( this was my personal preference and others may want to play with eq) but without eq adjustment they might not sound awesome on mid range phones.Connect them to a decent high end phone like Samsung Galaxy S series(you get complete 24 bit audio) or One plus 12 etc which support high and best resolution audio codecs, you will feel the true worth of these earphones.If you are a hard core bass lover where you want an extreme thump for all the types of music you hear then you may feel a little disappointed. The bass is definitely there but there are other headphones/tws for the extreme bass lovers. I personally tested this against One plus buds z2, One plus buds pro 2 and one plus buds 3 (the usual popular choices) and I felt for a basshead, one plus tws are much more suited but they lack in voice and instrument clarity a little.I could not test with realme air pro 6 and oppo enco x2 but I can tell from previous experience that the buds 2 pro fare better than them both and not just because this was last generation's flagship tws from samsung.The voice clarity and instruments sound a lot more realistic and full on the buds 2 pro. Very very close to apple air pods pro 2(apple still has a better edge).The design is extremely comfortable to me. This I feel is again subjective as some might feel them to be painful. I could simply sleep wearing them without any pain. Extremely snug fitActive noise cancellation is very decent, close to Sony's and apple flagship tws. For folks trying this for the first time or expecting to try noise cancellation on a flagship tws, don't expect complete zero noise from environment, it cuts most of it.Dolby atmos, 360 audio and head tracking. Dolby Atmos does make a significant difference. 360 audio with and without head tracking sounds amazing when watching videos. Netflix content will sound superb. For music just the eq at dynamic was more than sufficient. Using 360 for music was not very overwhelming, I felt it was just meh. But how to get the best of it, if you are using a mid range phone ditch Spotify and get apple music with lossless audio to get the best out this pair of tws for music. Amazon music and Airtel music were just meh. The tws shine the most on apple music as it supports proper Dolby Atmos codecs with lossless audio. For mid range phones that don't support high res audio this is a game changer. On high end phones the music quality is just awesome.Battery life, it took half hour for full charge and lasted close to 4hours 55 min with ANC on. I'm expetic close to 7 and half or 8 without ANC but then they sound best with ANC on. Overall moderate not amazing but not bad either.AI features, you need compatible samsung phones to get them to work(live language translation and transcribing).Overall they are a solid set of tws and definitely live upto the name of flagship tws. A perfect balance of sound clarity and bass. Mediocre battery, could have been better if they supported multi-point connectivity.",Galaxy buds 2 pro are they worth it?,0
4,I'm satisfied except battery life,Good product,0
4,Good comfortValue for moneyIssues in call quality,Boult Audio review,0
4,I mostly like the design,The sound is very good,0
4,,Good,0
4,Sound and best product,Good,0
4,Sound quality okay only but bass awesome 😎Touch control - superQuality - superPerformance - goodUse - comfortableFit - awesomeBattery life - good,Product review,0
4,Looks good. Easy to use. Value for money.,Good buy,0
4,I am very happy .🥴Noise Buds N1 Totaly Awesome 😎🤏,Buds N1 Pro Totaly Awesome,0
4,Ok ok,Display is very good,0
4,"Connect them to a cheap bluetooth transmitter for tv watching and you will be happy.Connects easily. Sound is good but battery doesnt last that long.  As an extra pair I use one earbud at a time and keep the other in the case, which it keeps getting charged.  A female voice warns if charge gets getting low or announces power off when the buds are out of range for a certain time.",Good,0
4,Awesome soung and good product quality,Good Earbuds in this price range,0
4,"The OnePlus Buds 3 offer an excellent blend of sound quality, comfort, and battery life. With active noise cancellation and an impressive sound profile, they provide a rich listening experience. The touch controls are intuitive, making it easy to manage playback and calls. The design is sleek and fits securely, perfect for extended wear. With good connectivity and a reliable battery, these earbuds are a great choice for anyone seeking quality audio on the go.",Excellent...,0
4,"Sound is good. Need to battery backup optimize. touch control bad. Touch control needs improvement, tws Case looking good.",Touch control bad,0
4,Good Sound Quality,Good Quality,0
4,Sound quality super,Boult k10 is ok,0
4,nice product,nice,0
4,It can cause the pain in ear slightly,It's has low latency as per brand mentioned,0
4,Everything is good but anc sounds like 25db. Good for gaming have battery life and smooth touch control everything is awesome only anc is little bit small db of hearing,ANC 32db,0
4,Trust worthy product,Good product,0
4,Good to listen and great experience 😌 tiny box but effective sound I liked it very much and worth for the amount. Thank u,Amazing,0
4,Quality of the product is good battery is also good the bass is not like as the oneplusRealme buds have better bass than OnePlus buds 2r,For OnePlus buds 2r,0
4,"This is a great earbud, the sound quality is awesome, under Rs 2199, highly recommend for this product. These earbuds are best for music, movies, study and calling.Thank u 😊 Amazon fast delivered",OnePlus Nord buds 2 one week after use review,0
4,Very good product 👍,Very good sound.👍,0
4,Good sound quality.,Sound quality,0
4,Good @ this price range,Good,0
4,You can go for it,Worth to buy,0
4,"Value for money item , just go for it",Worth it,0
4,Its most special feature is that calling is good even while driving.Nice,Its most special feature is that calling is good even while driving.,0
4,I had a problem with my Bird. Within 3 months it is having charging problem.,Birds ki problem,0
4,Good working,Noise less,0
4,Good,Good,0
4,This product is have fast connectivity and good battery performance. But the nocie cancellation feature is not average. Better for music and games.,Considered product.....,0
4,Product with all features of an expensive models,Value for money,0
4,Good fast service and superb product,Superb premium quality sound and superb clarity sound,0
4,"Products design, durability and base  are very good 👍",Products review,0
4,Sound quality and experience is so amazing.,Nice product,0
4,The product was good,Good product,0
4,Small size  easy to carry,Very powerful,0
4,,Good in this price range,0
4,"Sound quality is really great, great for listening music but not for gaming due to sound delay it's easy to use mic quality is great i really like this product",Honest Review,0
4,The sound and controls defines the worth of buying,Good funtionality,0
4,This was a good buying. Quality & performance both are good.,Good Product.,0
4,This is one of the best buds I’ve used in sound quality although its comfort is not good but the battery and connectivity are best. I used boat earbuds but shifting to it didn’t took me a lot of time so I’ll give it a 4 star,Awesome product.,0
4,"sound quality not good as JBL but other issues are sorted in this product. like batery life, connectivity.",loved it.,0
4,I like everything about them expect I can't use the high res as my phone doesn't support LHDC I know quite the bummer.,Remember Most phone do not support LHDC so be carefully,0
4,"Worth the price, nd i got a good deal with my CC .",Good Product,0
4,Nice package by one plus building kawlity also nice,"Nice product bass kawlity, call kawlity very nice 👍",0
4,-1 star because it sometime act up strange but its rare it sometime auto disconnects and everything else is great sound is solid fitting is good battery it good its around 5-6 hours and it does get to 90-95 percentage in 10 min,I love it,0
4,"Pros -If there is budget constraint, if you require noise cancelation, then you can go for this. This one has longer battery life as well. Monthly i charge twice or thrice ( i use atleast 4-5 hours per day )Cons -Fitting in the ear, a bit loose for me, i keep adjusting it. Try to use suitable/sizable ear buds.",Worth it (honest review),0
4,Best in class. Insan 1000 review dekhta hai par use sirf ek achha sound chahiye jisse woh apne pasandida gano ko sunke akelapan door kar sake. Aur yeh earphone sabse best hai bass mein sound me har chiz main. Bas iska Jo cover hai uspe scratch jaldi aate hai,Realme never let you down,0
4,everything was good sound quality 10/10 baddie. just check the color before buying I personaly prefer taking black or that green and also in white color the case also gets dirty and scratches are also visible and they get to easily so check before buying thats !!,Check color before buying !,0
4,Quality of sound is very good. And battery backup is minimal of 6 days.,Sound quality,0
4,Comfortable and call quality is superb,Call quality,0
4,Sound 🔊 mast hai 👍 like pro.,Mast,0
4,,Good performance,0
4,Good 👍,Very good 👍,0
4,Good quality earbuds under 4k,Quality buds,0
4,Average ANC and Bass,Best Product,0
4,"I have brought it only 1199, on release offer , currently showing 1799, I have to say below 2500 segment its a very good product.ANC and tranparent mode work properly, sound is goodCalling experience very goodBackground noise easily cancle out.",Sound and feature,0
4,Overall a good product. But needs to improve a little bit on the noise cancellation.,B,0
4,"The sound quality, bass everything is very good. But battery life and the fitting in ear isn't that good, like i have to adjust it every 5 minutes.",Fitting is not that good,0
4,"The touch controls are sometimes annoying , other than that amazing earpods",Really worth for the price,0
4,"1hour use , but ear👂,😭😭😭pain, sound super, bass sound super exlent 😘😍😍😍🤩🥰 tq OnePlus 🥳😘","1hour use ,but ear👂 pain , sound is super ,bass exlent",0
4,"Overall good and ANC working better , touch controls,comfort",Good,0
4,"A wide range of features at a reasonable price range. Good audio, music and gaming mode with a decent ANC.",Awesome earbuds,0
4,Fine quality of the earpods,Good quality,0
4,This buds are outstanding 😃 sound clarity.Pictch clear bass and sound.Very satisfied,Excellent 👌 Bass with ANC,0
4,GOOD PRODUCT.I think Z2 ANC is also good but this buds 3 pro is more comfortable and easy to carry.,Review,0
4,Nice,Boot,0
4,Hinge is quite off quality,Hinge problem,0
4,ঠিক ঠাক। sound is ok as per price segment .,Nice,0
4,"Excellent microphone, superb battery backup, good enough noise cancellation. Touch controls on the device are a bit shaky.",Value for money,0
4,,"Very Good To Use And Attractive Product Too, Love It ❤",0
4,"Absolute thumps up...upgrade over nord buds2...though nord buds2 sound clearer and more lively than buds3 but buds 3 has extra customization options in hey melody app like hybrid anc (low, moderate, high, smart options), golden sound option to boost sound after hearing test and ear canal test, 3d surround sound (though very loud and applies only to 3d suppored apps and videos). In-ear detection is a plus. Overall great buds below 5k (i grabbed it around 4.5k).Sound:7/10, bass: 8/10, anc: 9/10, battery: 8/10, call quality: 8/10)",Great buds!!!,0
4,"The media could not be loaded.
                



nice product. keep it simple. gi for it as for as 4000 rs me mil rha hoo...",nice nd sexy buds,0
4,Very Good Comfortable to uses,Excellent,0
4,Sometimes my ears start paining,Good sound but uncomfortable,0
4,Nice product,Realme,0
4,"Anc is good but it will not give you full isolation of the world but it is decent.Sound quality is good , and let me tell u that base is too much if u are a bass lover but if u want clear vocals and treble u need to switch between other modesBy the way it's worth the price of they are coming under 2500","ANC 4/5 ,SOUND 4/5 , BATTERY 4.5/5",0
4,"Good product in this price range and almost no lag experience in gaming mode,good sound",Good product,0
4,Overall good,Voice quality during call is low,0
4,Nice performance and fast charging,Bast sound,0
4,Nice mic quality,Mic quality,0
4,Very good product,Noise,0
4,"{ Better not best } Good for regular use , not to loud but nice and this is genuine review i have use it for 1 week. Delivery is on time and package is in very good condition hope u find it useful . no bill was there so little bit worried",pTRON earphone,0
4,Thank you one plus for giving a genuine product🙏,Aswm bass,0
4,1st impression... Superb sound voice.... Crystal calls.. Light weight....  Good product... Bsttery need to see how much time it will go.. Wil will update soon..... Too much better than redmi buds.. I got it 4800 just..... Happy... Happy....,Impressive earbuds in all aspect,0
4,"Product is as expected in colour, quality. Happy to buy this...especially it's noise controlling.",Nice product,0
4,Call quality is low.. other than that everything is fine,Cons,0
4,Crystal clear sound and thumping bassJust go for it,Best in budget,0
4,"The media could not be loaded.
                



I like everything about it but Giving 4 star because i use iPhone 13 and Realme link Doesn’t have this Model in the app so i have to connect android to modify settings",Better in Budget,0
4,Sounds quality is Good. Good build quality.,Good Product,0
4,Best,Worth,0
4,It good product under this price range,Good product,0
4,Nice earbuds wuth good music and sound,Good,0
4,Really good product.. I'm buying product 1499 offer price that price really worth.. quality.. sound. Battery .. look.. everything fine,Nice product,0
4,Call quality is low... Noise cancellation is low,Noise N1 pro,0
4,Performance is best and one charge and use 3day noise wow 😲😲 bestAnd I am using for 3 weekAnd ease to fit with your ear 👂 on pain,Best noise,0
4,,OnePlus buds 3 nice product,0
4,Design and look is good but sound quality isn't that great,Sound quality ok ok,0
4,The product is good and audio quality is also good.,Good sound,0
4,Quality is 👍,Good one,0
4,"Yes, I like the product the design and sound quality is very good.",A good quality product,0
4,Great product sound is clear,Sound clearity,0
4,Liked. Good audio clarity. Good bass. Good product.,Good product,0
4,Battery🔋 is awesomeSound quality is goodBass is also good at this price range.....,Ptron earbuds,0
4,,Noise review,0
4,"Really good battery backup, 11 mm driver is sufficiently generates soothing sound not too loud not too low just perfect....ANC works just fine .. Game mode and music modes are okBut the transperant mode creates unnecessary noic...All in all great look and fitting and right choice in the prise segment ...",Value for mony,0
4,It's Really Good Product...Value For money...calling performance good Very Clear voice...,Best Product,0
4,More battery capacity and good noise cancellation. I like this product,Nice product and nice stylish,0
4,Battery charge only 2 days thats problam .,Nice sound quality,0
4,Not typical sturdy if one used airpod beforeBut sound quality niceNot much in department of noise cancellationBut overall value for money,My review,0
4,THE PRODUCT IS TOO PREMIUM BUT ITS FITTING IS LOW QUALITY AND NOICE CANCELLATION IS  TOO GOD IN THIS PRICE SEGMENT ANYONE COMPANY NOT PROVIDE LIKE THIS NOICE CANCELLATION AND HIGH VOLUME FEEL LOW BYT OVERALL PRODUCT IS FOR RECOMMENDED,PRODUCT IS GOOD,0
4,"This product is value for money in this price segment,ANC performance is good, Base balance also good..",Value for money,0
4,sound quality is good. nice user experience.,GOOD,0
4,iPhone is not app support,iPhone is not app support,0
4,"The media could not be loaded.
                



Battery life is good, sound is really good, In-ear fit is great, doesn't even hurt after long day of use.Active Noise Cancellation is average.For the price its great",Good enough for price,0
4,Sound quality is better. But not for gaming,BEST SOUND,0
4,Superb,It's amazing,0
4,Good,Boult ufo,0
4,Good product,Product is good,0
4,The clarity was great and the anc was able to remove the fan noise,Great earbuds with decent noise cancellation,0
4,Best Product,Best,0
4,Excellent build quality.,Earbuds,0
4,Nice sound and good bass some time connection issue but over all value for money 💰,Good quality,0
4,Sup product & good experience over all,Best in quality & delivery,0
4,Sound Quality is ok ok. Volume and bass is also in medium range.,Sound Experience is not so good.,0
4,Sound is good according to priceBut ear buds should be little more small to fit in ear,Good product,0
4,This Not For gaming  like bgmi,Gaming BGMI,0
4,"Sound is good, lacks comfort.",Cost Friendly Earpods,0
4,Been Using from one month everything seems good,Worth a price,0
4,My ear is very pain to after use this ear buds,Quality is good but in ear buds not to be comfortable in ear,0
4,"I bought this product on Amazon. Great product. Sound quality, design and battery is upto expectation. Really liked this product. It is surely value for money.",Crossbeat slide earbud,0
4,The battery life is good it’s very easy to use,It has a very good sound quality And anc,0
4,Nice,Buds,0
4,"Honestly, these earbuds are a great option! The sound is super clear, with nice bass, battery backup is good, ANC isn't that good.",Great product,0
4,Design-GoodCharging speed -GoodSize-SmallCall quality -GoodComfort-GoodEase of use -Very much,Very good as well as budget friendly,0
4,"The buds are very good, the sound is very good, it is the best, there is only one problem, the game sound in gaming mode comes late",Good,0
4,Valu of mony.. Goog prdect,Best bes and very light,0
4,"good bass, clear voice, charging also good.... best product in price range",best in price range,0
4,Best product,Best,0
4,Best but no volume control 😔Average at gaming purposeMic quality is bestBattery backup 😊,Buds 2r,0
4,Nice product with great music quality but battery backup is low and some issues with connectivity at the and it is good product,Buds,0
4,"The product quality is pretty good, with good sound and mic quality.",Pretty Good Sound and Quality,0
4,Sound good 👍Bass  to good 😊Clear voice ✅Need improvement of battery 🔋,Improve battery life,0
5,Worth it 😉 Best sound quality and base.Easy to handle and operate.U get a best sound on call as well.,Best earbuds ever use,0
5,I just have bought one plus ear bud 3 it's awesome with its sound quality ane very easy to pair and voice of call is very clear to hear and noise cancellation is very impressive and the end of my reviews i am very happy to but it,Awesome,0
5,"I had Jabra elite 4, bluetooth.The sound quality is better than that.Will post after usage of 1 month as well.",Music Clarity is awesome 💯,0
5,"Dear Amazon/ supplier  I am very to buy this Product from you it is very valuable for me and  enjoying every beat and moment which they bring in my life also the experience matters us for me and I am thrilled to share the review of this product this product have amazing battery life , Fully comfortable for my ears and perfect Connectivity, glorious design, easily fit for everyone and Mind-blowing Sound Clarity and Quality""Music is the universal language of mankind.""KEEP IT UP AMAZON/SUPPLIER","""Exceptional JBL 245NC Earbuds: Unmatched Comfort, Stunning Design, and Mind-Blowing Sound Quality!""",0
5,"These are my 2nd pair of Galaxy Buds 2 pro. They are so comfortable and easy tp use that you ger used to it pretty quickly. The noise canceling is great. Call quality is best, the other person can hear you properly even when you are in noisy environments. Sound wuality is good, not as good as the earpods. But its comparable for sure. I've tried apple air pods too. But they are very expensive and are only slightly better than these. Though I think samsung should add last location of buds which apple has and is super important. I lost just 1 bud and had to buy another.",Best among all earpods,0
5,Superb earbuds boult the colour and design looks so cool and noice and for calls is awesome superb bass great connectivity great hours time overall superb earuds,Superb earbuds,0
5,"Very loud and clear music, best noise cancellation, mic is working very fine, clear calling, best in this price segment",Best in budget and sound,0
5,I like it 😊,Feedback,0
